Eastern Polytechnic, Rivers State
Federal College of Forestry, Ibadan, Oyo State
Ramat Polytechnic, Borno State
College of Agriculture, Kabba, Kogi State
Samaru College of Agriculture, Kaduna State
The Polytechnic, Ibadan, Oyo State
Abdul Gusau Polytechnic, Zamfara State
Federal College of Land Resources Technology, Owerri, Imo State
Nasarawa State Polytechnic, Nasarawa State
Gateway Polytechnic Saapade, Ogun State
Maritime Academy of Nigeria, Akwa Ibom State
Akperan Orshi College of Agriculture, Benue State
Federal College of Animal Health and Production Technology, Vom, Plateau State
Abubakar Tafari Ali Polytechnic, Bauchi State
Federal College of Wildlife Management, Niger State
Federal School of Dental Technology & Therapy, Enugu State
Ibrahim Babangida College of Agriculture, Cross River State
Delta State College of Agriculture, Delta State
Shaka Polytechnic, Edo State
Imo State Technological Skills Acquisition Center, Imo State
Plateau State College of Agriculture, Plateau State
Tower Polytechnic, Ibadan, Oyo State
Borno College of Agriculture, Borno State
Lagos City Polytechnic, Lagos State
Adamawa State Polytechnic, Adamawa State
Federal College of Animal Health & Production Technology, Oyo State
Hussani Adamu Polytechnic, Jigawa State
Federal Polytechnic, Mubi, Adamawa State
Kwara State Polytechnic, Kwara State
Petroleum Training Institute, Delta State
Imo State Polytechnic, Imo State
Foundation College of Technology, Akwa Ibom State
Niger State Polytechnic, Niger State
Benue State Polytechnic, Benue State
Plateau State Polytechnic, Plateau State
Wavecrest College of Hospitality, Lagos State
Hassan Usman Katsina Polytechnic, Katsina State
Wolex Polytechnic, Lagos State
Allover Central Polytechnic, Ogun State
Federal College of Chemical and Leather and Technology, Kaduna State
School of Agriculture, Ikorodu, Lagos State
Federal College of Land Resources Technology, Kuru, Plateau State
The Polytechnic, Calabar, Cross River State
Akwa Ibom State Polytechnic, Akwa Ibom State
Federal College of Education, Pankshin, Plateau State
Mai Idris Alooma Polytechnic, Yobe State
Osun State Polytechnic, Osun State
Federal Polytechnic, Birnin-Kebbi, Kebbi State
Akanu Ibiam Federal Polytechnic, Ebonyi State
Auchi Polytechnic, Edo State
Federal Polytechnic, Nekede, Imo State
Federal Polytechnic, Ede, Osun State
Federal Polytechnic, Bauchi, Bauchi State
Our Saviour Institute of Science and Technology, Enugu State
College of Agriculture, Jalingo, Taraba State
Rivers State College of Arts and Science, Rivers State
Mohammed Abdullahi Wase Polytechnic, Kano State
Kogi State Polytechnic, Kogi State
Federal Polytechnic, Nassarawa, Nasarawa State
Rivers State Polytechnic, Rivers State
Federal College of Forestry. Jos, Plateau State
Bayelsa State College of Arts and Science, Bayelsa State
College of Agriculture, Lafia, Nasarawa State
Kaduna Polytechnic, Kaduna State
Federal Polytechnic, Offa, Kwara State
Niger State College of Agriculture, Niger State
Federal Polytechnic, Oko, Anambra State
Federal Polytechnic, Bida, Niger State
Rufus Giwa Polytechnic, Ondo State
Federal Polytechnic, Ilaro, Ogun State
The KINGS Poly, Saki, Oyo State
Moshood Abiola Polytechnic, Ogun State
Maurid Institute of Management & Technology, Nasarawa, Nasarawa State
College of Agriculture, Zuru, Kebbi State
Dorben Polytechnic, Abuja FCT
College of Agriculture and Animal Science, Kaduna State
Polytechnic Ile-Ife, Osun State
Marvic Polytechnic, Ogun State
Southern Nigeria Institute of Innovative Technology (SNIITPOLY), Osun State
Federal Polytechnic, Damaturu, Yobe State
Yaba College of Technology, Lagos State
Lagos State Polytechnic, Lagos State
Federal College of Fisheries and Marine Technology, Lagos State
Hussaini Adamu Federal Polytechnic, Jigawa State
Abdul Gusau Polytechnic, Zamfara State
Federal Polytechnic, Idah, Kogi State
Federal Polytechnic, Ado-Ekiti, Ekiti State
Federal College of Forestry Mechanisation, Kaduna State
Ronik Polytechnic, Lagos State
Kebbi State Polytechnic, Kebbi State
Temple Gate Polytechnic, Abia State
Kano State Polytechnic, Kano State
Federal College of Fresh Water Fisheries Technology, Niger State
Grace Polytechnic, Lagos State
Ekwenugo Okeke Polytechnic, Anambra State
Federal Polytechnic, Namoda, Zamfara State
Institute of Management Technology, Enugu, Enugu State
Federal College of Agriculture, Ishiagu, Ebonyi State
Kings Polytechnic, Edo State
Federal College of Animal Health and Production Technology, Ibadan, Oyo State
Akwa-Ibom College of Agriculture, Akwa Ibom State
Audu Bako School of Agriculture, Kano State
Osun State College of Technology, Osun State
Nigerian College of Aviation Technology, Kaduna State
Nuhu Bamalli Polytechnic, Kaduna State
Delta State Polytechnic (three institutions), Delta State
